{
  "schema_version": 1,
  "status": "published",
  "product_id": "winvidcompress",
  "name": "WinVidCompress",
  "summary": "A local Windows video compressor built with PowerShell and FFmpeg. Drag files or folders onto the launcher to create consistent H.264/AAC MP4 viewing copies.",
  "source_repository": "https://github.com/PikkuJanne/WinVidCompress",
  "processing_location": "user_device",
  "uploads_supported": false,
  "reviewed_default_profile": {
    "video": "libx264", "preset": "veryfast", "crf": 22, "pixel_format": "yuv420p",
    "audio": "aac", "audio_bitrate": "160k", "container": "mp4", "faststart": true,
    "oriented_height_cap": 1080, "crop": false, "upscale": false, "output_layout": "flat"
  },
  "candidate": {
    "version": "0.1.0-rc.1",
    "status": "unpublished_candidate",
    "source_commit": "b2582bd24b7efaa896b51d468c3679ee83bcb909",
    "application_sha256": "ead0c7b785a4a6092ce70af8b34097a579e9c6ac31ecaeba2087692c9266476b",
    "launcher_sha256": "0d97c046847d7002e78b23d91c4caca3498c88b9c932ae84158da9e4db51ba3f",
    "evidence": [
      "https://github.com/PikkuJanne/WinVidCompress/blob/b2582bd24b7efaa896b51d468c3679ee83bcb909/docs/codex-winvidcompress/evidence/WVC-M5-03.md",
      "https://github.com/PikkuJanne/WinVidCompress/blob/b2582bd24b7efaa896b51d468c3679ee83bcb909/docs/user/VERIFICATION.md"
    ]
  },
  "requirements": [
    "Windows; recorded workstation tests use Windows 11 Pro x64.",
    "Windows PowerShell 5.1 (BAT launcher) or supported stable PowerShell 7 (direct PS1).",
    "Separately supplied FFmpeg and FFprobe with libx264, AAC, MP4/faststart, scale and JSON/CSV probing support.",
    "An available writable output directory and sufficient free space; no administrator account required."
  ],
  "tested_platforms": [
    "Windows 11 Pro 10.0.26300 x64; Windows PowerShell 5.1.26100.9444 Desktop and PowerShell 7.6.6 Core.",
    "FFmpeg/FFprobe 2026-10-04-git-a35c879992 essentials Windows build; tests describe this build, not every dependency build.",
    "Prior Windows CI Targeted tests run on windows-2025 in both PowerShell hosts; separate Full/manual/release evidence applies."
  ],
  "setup": [
    "Extract the scripts together; read README and keep the offline user guides and policies.",
    "Obtain FFmpeg/FFprobe from a Windows provider linked by FFmpeg's download page and follow the provider's integrity checks.",
    "Use an existing PATH installation or place both executables adjacent to the scripts; PATH takes precedence.",
    "Run -CheckEnvironment, then separate -WhatIf and first-copy commands with explicit disposable inputs and an existing output folder.",
    "Use the four-item menu or drag/drop launcher for everyday sequential batches; default output is flat with safe collision renaming."
  ],
  "privacy": [
    "Compression runs on the user's device. No application uploads, telemetry, accounts or automatic dependency downloads.",
    "Explicit UNC inputs and outputs can access network shares.",
    "Config, local logs, manifests and outputs can contain private paths, filenames and metadata. Review before sharing."
  ],
  "links": {
    "source": "https://github.com/PikkuJanne/WinVidCompress",
    "license": "https://github.com/PikkuJanne/WinVidCompress/blob/b2582bd24b7efaa896b51d468c3679ee83bcb909/LICENSE",
    "support": "https://github.com/PikkuJanne/WinVidCompress/issues",
    "security": "https://github.com/PikkuJanne/WinVidCompress/blob/b2582bd24b7efaa896b51d468c3679ee83bcb909/SECURITY.md",
    "changelog": "https://github.com/PikkuJanne/WinVidCompress/blob/b2582bd24b7efaa896b51d468c3679ee83bcb909/CHANGELOG.md",
    "instructions": "https://github.com/PikkuJanne/WinVidCompress/blob/b2582bd24b7efaa896b51d468c3679ee83bcb909/README.md",
    "verification": "https://github.com/PikkuJanne/WinVidCompress/blob/b2582bd24b7efaa896b51d468c3679ee83bcb909/docs/user/VERIFICATION.md",
    "ffmpeg_download": "https://ffmpeg.org/download.html",
    "ffmpeg_license": "https://ffmpeg.org/legal.html"
  },
  "published_version": "1.0.0",
  "release_date": "2026-10-08",
  "release_url": "https://github.com/PikkuJanne/WinVidCompress/releases/tag/v1.0.0",
  "download_url": "https://github.com/PikkuJanne/WinVidCompress/releases/download/v1.0.0/WinVidCompress-1.0.0.zip",
  "sha256": "5c26d993e482204f80b81f10b8833315ac40c2c8d800b5bdaa7424567298b858",
  "screenshots": [
    {
      "file": "screenshots/menu.png",
      "sha256": "894538401cbe2dc7d109cfb8bb2385cbbcb6558f48a815e8b0d261c3495896ba",
      "alt": "The actual WinVidCompress four-item menu with an isolated demo output folder.",
      "caption": "Owner-supplied actual Windows PowerShell 5.1 menu capture, 2026-10-08. The scripts match source b2582bd24b7efaa896b51d468c3679ee83bcb909. Only unrelated desktop at left and bottom was cropped; all retained menu pixels are unchanged. This image demonstrates the menu, not a compression or playback result.",
      "source_commit": "b2582bd24b7efaa896b51d468c3679ee83bcb909",
      "capture_method": "actual_window_capture",
      "redactions": ["Cropped unrelated desktop only: original 1172x435; rectangle x16, y0, width1156, height399. No menu pixels altered."]
    }
  ],
  "measured_examples": [
    {
      "file": "examples/synthetic-default.json",
      "sha256": "0eeed1c63cc0f675baffc6d02687449cbd191426fa85dcf5272c3d9cc082fdef",
      "label": "Four-second synthetic pattern and tone: FFV1/PCM source to the fixed H.264/AAC profile, three local runs.",
      "scope": "Synthetic lossless input, not a typical already-compressed interview. Real measured bytes and local warm-cache timings; results vary and valid outputs can grow. Playback NotRun; structural validation is not perceptual proof."
    }
  ],
  "known_limitations": [
    "Lossy viewing copies are not archival masters. Keep originals and review outputs; a valid output can be larger.",
    "Detected HDR is refused; no tone mapping. Ambiguous colour warns. Other video/audio streams, subtitles, data and attachments are omitted and reported.",
    "BAT paths containing variable-shaped percent segments such as %PATH% require literal-path menu or direct PS1 routes. Outer CMD delayed expansion and the CMD command-line limit also apply.",
    "Oriented height cap is 1080 with even dimensions, no crop or upscale; width is not capped at 1920.",
    "Compatible source tags may remain. Compression does not sanitize private metadata.",
    "Structural validation does not prove full visual/audio integrity. Bounded recorded owner playback checks are not whole-original, HDR or every-player acceptance.",
    "Remote SMB/disconnection, arbitrary filesystems/long paths, power loss, hostile substitution, console close and detached descendants have broader unverified limits.",
    "Release source/ZIP verified and candidate accepted on 2026-10-08 with documented exclusions. Browser/MOTW, fresh-profile, default-Videos first launch and final-candidate perceptual checks remain unobserved.",
    "Unsigned, tool-only release. Historical candidate provenance remains dated. Checksums detect changed bytes, not publisher authenticity or guaranteed safety. FFmpeg has separate build-dependent license terms."
  ]
}
